{
  "$schema": "./zones.schema.json",
  "version": 1,
  "site": {
    "name": "Vantara",
    "location": "Jamnagar, Gujarat, India",
    "disclaimer": "Unofficial fan reconstruction. Not affiliated with or endorsed by Vantara."
  },
  "map": {
    "image": "/map/overview.svg",
    "width": 2048,
    "height": 1536
  },
  "zones": [
    {
      "id": "elephant-care-centre",
      "name": "Elephant Care Centre",
      "description": "Shelters, pools and care facilities for rescued elephants.",
      "videos": [],
      "map": { "x": 0.386, "y": 0.487 },
      "animals": ["elephant"],
      "status": "live"
    },
    {
      "id": "big-cat-rescue",
      "name": "Big Cat Rescue",
      "description": "Enclosures for rescued tigers, lions and leopards.",
      "videos": [],
      "map": { "x": 0.71, "y": 0.491 },
      "animals": ["tiger", "lion"],
      "status": "live"
    },
    {
      "id": "herbivore-reserve",
      "name": "Herbivore Reserve",
      "description": "Open paddocks for rhinos and other large herbivores.",
      "videos": [],
      "map": { "x": 0.874, "y": 0.494 },
      "animals": ["rhino"],
      "status": "live"
    },
    {
      "id": "wildlife-hospital",
      "name": "Wildlife Hospital",
      "description": "Veterinary hospital and rehabilitation wards.",
      "videos": [],
      "map": { "x": 0.605, "y": 0.449 },
      "animals": [],
      "status": "live"
    }
  ]
}
